{
  "version": 1,
  "kind": "authoring",
  "authoringId": "2609241219-headless-review",
  "artifact": "docs/specs/2609241219-headless-review.md",
  "artifactKind": "spec",
  "shape": "full",
  "sourceSha": "dbda5d1aab5f76e194aabb02f92e5fef2ff9d9a7",
  "provider": "claude-code",
  "model": "claude-opus-5-5",
  "effort": "high",
  "outcome": "committed",
  "usage": {
    "available": true,
    "usage": {
      "provider": "claude-code",
      "inputTokens": 28,
      "cacheCreationInputTokens": 109781,
      "cacheReadInputTokens": 1164741,
      "outputTokens": 60242,
      "totalCostUsd": 2.3161481999999998
    }
  }
}
